S. No.,Category Name,URL if available,Description(Minimum 80 words),location,contact(Multiple If available),Reviews,Rating,Images
1,Hilton Hotel,http://www.hilton.com,"Hilton Hotels & Resorts is Hilton Worldwide's flagship brand and one of the largest hotel brands in the world. The brand is
 targeted at both business and leisure travelers with locations in major city centers, near airports, convention centers, and 
popular vacation destinations around the world Hilton Hotels & Resorts participates in Hilton HHonors, Hilton Worldwide’s 
guest loyalty program. Members who book directly through Hilton-owned channels receive exclusive discounts and amenities 
such as free Wi-Fi, digital check-in, keyless entry, and the ability to select the room they'd like using the Hilton HHonors app.","Golf Course Road, Sector 56, Gurgaon, Haryana 122011",0124 491 1234,"1. A contemporary stay experience with good rooms, good food and hospitable staff. 
There is a restaurant and a bar which can together serve any palette. And any time you 
stay there, don't forget the amazing welcome cookies. ",4,Y
,,,,,,"2. Great infrastructure, very supporting and friendly staff",4,
,,,,,,"3. Very satisfied with the hotel and it's proximity to my client office. Customer service is 
prompt and friendly, the hotel proactively contacted prior to my arrival to see if I needed a 
pickup from the airport. It's a relatively quiet hotel not bursting at the seams with guests, 
which suits me just fine. The executive lounge is now available which is good. The rooms
 are nice and overall I will continue recommend to peers and use for future stays. ",5,
,,,,,,"4. Good exposure , Management development trainings, Good scope to improve 
management skills, Good work ethics",3,
,,,,,,"5. One of the best chain among the hospitality Industry. Professonal managment & 
good policy",3,
,,,,,,,,
2,TAJ HOTELS RESORTS AND PALACES MUMBAI,,"Rooted in history and tradition that deliver truly unforgettable experience, 
 each Taj hotel, resort and palace reflects the tradition of hospitality to create lifelong memories. Awaken your inner self with our award winning,
 all-natural spas rooted in traditional Indian well-being and spirituality. We offer a milieu of old India  therapies and beauty secrets to foster 
harmony and equilibrium within you. These time-tested wellness rituals are now within reach inside the soothing sanctuaries of every Jiva Spa.","Apollo Bunder, Mumbai, Maharashtra 400001",022 6665 3366,"1. One of the best and the biggest hotel of mumbai. Very good service. The food is so tasty.
 So many celebrity come to this hotel. Best security. Best hotel to visit with your friends and family.",5,
,,,,,,"2. Outstanding service and a beautiful place with lots of history on itself. Gorgeous pool area.
 Palace rooms are gorgeous and well equipped.",4,
,,,,,,3. A well mantained high quality rich hotel a pride for mumbai and whole of india.,3,
,,,,,,"4. There no hotel like this in Mumbai, India,Asia,world... Not a singlehotel of world can match
 the luxury of taj mahal hotel...",2,
,,,,,,"5. The Taj Mahal Palace is of course an icon in Mumbai; therefore i had very high expectations 
before i arrived. The building is stunning and it really is a haven of relaxation in the centre of a
 very crowded city.",4,
,,,,,,,,
,,,,,,,,
3,Grand Dragon Ladakh,http://www.thegranddragonladakh.com," Established in the year 2007, The Grand Dragon Ladakh, one of the first luxury hotels in Ladakh, is owned and operated by the Abdu family from Leh, who have more than 40 years of experience welcoming visitors to the beautiful region. It is decorated magnificently with handmade paintings by Gulam Mustafa (First modern Artist of Ladakh) around every corner, and fixtures that are reminiscent of royalty.
The Grand Dragon Ladakh is the first hotel with a host of state of the art amenities, such as electronic key cards for the rooms and a baggage scanner, as well as their own sewage treatment facility. The entire facility is wheelchair accessible, for providing differently abled guests with a comfortable sojourn.The attention to detail offered by the associates, coupled with the magnificent views, will guarantee you take back home sweet memories.","Old Road, Sheynam, Leh Ladakh, Jammu and Kashmir 194101",099069 86782,1. Had a wonderful time at this hotel with all the luxury of best five star.,4,
,,,,,,"2. The grand dragon is a welcoming and very well run luxury
 hotel in the heart of Leh.",4,
,,,,,,"3. The Grand Dragon is quite simply, the most luxurious
 hotel you can find anywhere within Ladakh. But it's not
 just luxury, they do comfortable very well too",4,
,,,,,,"4. Food served was excellent considering both taste and
 quality.Surprised to see such good quality of food in Leh",3,
,,,,,,"5. A top quality hotel; clean rooms, spacious bathroom, 
nice lounge and covered outdoor seating/dining areas 
with great view of nearby mountains.",5,
,,,,,,,,
4,Ladakh Lharisa,http://www.ladakh-lharisa.com/,"India vows of a profusion of scenic beauties, an exuding mishmash of cultures, a variety in climatic conditions - all things that hold fun for a global traveler. In this mesmerizing land, Leh claims a position of distinction. It has been a preferred choice for both adventure junkies and culture aficionados for years. Leh is a land of quaint boulevards, vibrant marketplaces, old-world monasteries, breathtaking Himalayan views and something angelic that only Leh can offer. And what better way to experience Leh than staying at Lha-Ri-Sa!","Skara, Leh, Ladakh, Skara, Leh, Jammu and Kashmir 194101",01982 252 000,"1. I find the only resort with oxygen cylinder at the Reception with Oxymeter.  Some people may have oxygen problem, specially those coming by AIR to Leh.",4,
,,,,,,"2. Very comfortable and within city limits. Rooms are well
 insulated from cold and noise. Food is on the average 
side but service is amazing.",3,
,,,,,,"3.all things that hold fun for a global traveler. In this 
mesmerizing land, Leh claims a position of distinction.
 It has been a preferred choice for both adventure junkies 
and culture aficionados for years.",4,
,,,,,,"4. In Leh, you have many passes (Lha), mountains (Ri) 
and beautiful mother earth in the forms of astonishing 
mountains (Sa) and also you have Lha Ri sa.",,
,,,,,,"5. Lha-Ri-Sa is a very pleasant surprise. Located a little
 away from the main market, it is still just a walk away 
(half-an-hour, at most). For those who aren't in a mood to 
walk, the hotel arranges transport.",4,
,,,,,,,,
5,Royal Heritage Resort,www.royalheritageresortleh.com,"RoyalHeritage resort has developed with a unique concept of providing a serene atomosphere to the visitors; it is situated on the main fort road at a walking distance of 15 minutes from the heart of Leh Town, the centre of modern amenities viz; banks, airline offices, govt Offices, tourist reception centre etc. The locations and landscaping of the resort provides visitors with memorable and breath taking panoramic view of snow covered mountains from amidst greenery of poplar and willow trees/ orchard.","Fort Rd, Leh, Jammu and Kashmir 194101",096978 57450,"1. Service is kind of poor with very limited staff. Food is 
just average. Needs bit improvement.",2,
,,,,,,"2. Average property with good location. Hotel is located 
near to market place. Daily need shops are just 10-15 meters 
from hotel. Staying in a cottage is better option rather than 
standard rooms. Room furniture is not nice. Wash rooms are 
basic.",4,
,,,,,,"3. We checked in here through Make my trip however the 
service by Make my Trip was pathetic. The owner Mr. Norboo 
is a gem of a person. He helped us a lot during the stay and 
extended what I would say is amazing hospitality.",4,
,,,,,,"4. The impression of property is not very heart warming. Food
 spread is also average but simple and good in quality. What
 impressed us the most is the friendly nature of the owners 
and the staff. ",4,
,,,,,,"5. Booked this hotel because we got floored by the website. 
Stayed in the independent bungalows, which are good but the
 housekeeping needs a big slap on the wrist.",3,
,,,,,,,,
6,Blossoms Village Resort,http://www.blossomsvillage.com/,"Blossoms Village Resort is located in a peaceful location in Dharamshala, Himachal Pradesh in India. Nestled at the foothills of the magnificentDhauladhar mountain range, Blossoms Resort is a premium resort and hotel in Dharamshala,  with eco-friendly construction and natural and pristine surroundings - A perfect getaway destination in the Himalayas.The resort at Dharamshala is an amalgamation of modern and the rustic, whether its My Earth store's  grounding touch or Maitreya Study Centre's expansive spirit and spa. Our guests get a relaxing stay at Dharamsala Resort with all the modern  amenities and facilities of an upmarket hotel, along with tailor-made services to suit every guest's needs.","Sidhpur, Dharamshala District Kangra Himachal Pradesh-176057",0867 924 6880,"1.Beautiful place surrounded by hills from almost all side... 
Very nicely constructed room.... iconic Balcony to every room... 
Food was not very excellent ...Breakfast was tasty... Room, Lawn, 
Sports activities... very nice palce in a budget for a family...",4,
,,,,,,"2. What can i say...this resort nd restaurant have a special place in 
my heart..last end of my colg time i visited this place so frequently
 ....the bone fire ..the lights ...the location ..i love every bit of it...one
 of the thing which i m gonna miss like i m gonna miss my colg...",5,
,,,,,,"3. I with my family stayed in this blossom village resort during our 
summer holidays. The location of the resort is in the village which
 is 5 km away from dharamshala. The place is very quiet and 
surrounded by farms in a valley. The resort is facing snow capped 
mountains. Resort facilities and staff are also very good. Services are also... ",4,
,,,,,,"4. This resort is a small heaven on earth!!! Its located perfectly facing the 
mountains and not too far away from the market place or even Mcleodganj!!! 
The staff are so very courteous and patient and will always serve you with a 
smile on their faces.Good food,served well. The owner himself,Nalin, is a 
lovely person, very accommodating and extremely helpful thus... ",4,
,,,,,,"5. The resort true to its name, is tucked in a village, there are some patches
 of agricultural land close to the property. You will be surprised to see the 
number of birds from this property... with my very limited knowledge of 
birds, I could spot more than 15 species of birds. Its a great experience 
to sit in their roof top restaurant, which offers a great view of the mountain 
range and listen to the birds chirping.",5,
7,Umaid Bhawan Palace Jodhpur,,"One of the largest royal residences in the world, the golden-yellow sandstone Umaid Bhawan Palace is a monument to 
Jodhpur’s gallantry and romance. Guests get a taste of what it was like to live like kings. From rooms once occupied by the 
Maharaja. From regal pastimes like polo or croquet. From magnificent views of the palace gardens and the spectacular 
Mehrangarh Fort. From unique themed dinners that flaunt all the pomp-and-splendour of the desert kingdom.","Near Circuit House, Jodhpur 342006, India",0291 251 0101,"1.Awesome place superb hospitality located at an awesome place you 
can have a view of whole city one of the best in Jodhpur
",4,
,,,,,,"2.fantastic place, good location. If you will come jodhpur then you want see
 this place.",4,
,,,,,,"3.It's amazing place.Most beautiful place I ever seen.must visit Umaid 
palace. I like marwadi food..must visit clock tower.I take food at shandar 
restaurant. I like lassi .lasan chatani at restaurants. Like so much",5,
,,,,,,"4.It's very beautiful palace and nature palace. I have not saw this palace in 
my life.",4,
,,,,,,,,
,,,,,,,,
,,,,,,,,
,,,,,,,,
,,,,,,,,
,,,,,,,,
8,Club Mahindra Valley resort,,"Club Mahindra Valley Resort Binsar is perched on top of a hill with a spectacular view of the snow capped peaks and the Almora
 Valley which is the epitome of serenity and tranquillity. Surrounded by abundant garlands of alpine flora, ferns, hanging moss and
 many other species of wild flowers, this is as close as one would get to heaven. The resort in itself is beautiful to look at with its 
slate roofing, stonewalls and beautiful wood carvings, typical of the Gupta period. It fits well amidst the alpine flora, hanging moss 
and vibrant spray of wild flowers that carpet the village.","Almora Takula Bageshwar Road, Bhainsori Post, Almora, Sunoli Mafi, Uttarakhand 263684",083929 10583,"1. Serene silent place.... you can hear water fall so clearly... such a lovely
 ranges.. Abundance of greenery all around makes everything so fresh and 
beautiful... words are less to express the beauty of this place ... a must visit
 place to have silent comfy break from hectic places... ",4,
,,,,,,"2. Resort is like a house, feels like on a vacation. No feeling of hotel and having
 pleasure experience, will visit again. The problem is distance only which is far 
from station or from connecting roads",3,
,,,,,,"3. The unique experience to stay in log huts in hill top, with breath taking views
 fm the balcony, trekking in the mountains, bird watching, viewing the sunset fm 
the sunset point, was an overall amazing experience which we will cherish life 
time ",3,
,,,,,,"4. This is among one of the best maintained Club Mahindra properties. The 
studio apartments are well furnished and superbly maintained. The sofa's in 
the room are unfortunately too soft and not great for sitting. Ground floor 
apartments are compromised for privacy. The service is outstanding and very 
responsive.",4,
,,,,,,"5. The property doesn't need any description, standard quality like all their resorts, 
pretty well maintained, spacious, luxurious and ample. No complains in that or the 
room service or any other aspect.
Jack their bird watching guide was a joy infact to move along with on mornings we 
spent for Bird Watching. ",3,
,,,,,,,,
9,Sattal Forest resort,,"Enjoy views of the surrounding lakes and hills from your private cottage at V Resorts - Sattal Forest Resort. Located at an altitude 
of 1,524 m in the heart of the Kumaon Hills, the resort has a 24-hour front desk and its very own restaurant. Located near the 
quaint town of Bhimtal in Nainital District, Sattal Forest Resort is 12 km from Praathmik Swaastha Kendra, a health centre. 
Pantnagar Airport is approximately 55 km from the resort. Large glass windows and panelled doors front each cottage, which 
comes with heating and a private bathroom with hot water. A seating area and TV are also included.",Uttarakhand 263136,081307 77222,"1. My room location is very nice because my room was lake view room.
The rooms are fine; staff attempt to be helpful, breakfast is good. Bathrooms and water 
supply as well. The Hotel Staff and Both Managers are nice people. Food are also 
beautiful. I enjoyed food. Rooms and hotel also neat and clean.
You get to see the entire valley and evenings are very relaxing. If it rains when you 
around, you feel like you got the value for your money and a bit more. ",4,
,,,,,,"2. Its one of the best properties, that I have been to...and I am not talking about luxury or 
5star place. But a beautiful location, where the staff will make you feel home and do their 
best and to cater your needs. Thanks to Mr.Shailendra (Manager) and other staff 
members for their hospitality. The food is homely and tasty!! We were in a group of 9 
and everyone loved the place!!!",4,
,,,,,,"3. Serenity is the word you will say when you visit this place. The property has been built 
away from the city on the hills. It's so peaceful and calm that you just fall in love with the 
place. We had one whole apartment booked so it was like having your own private home
 on the hill top. The view from our balcony was amazing.",3,
,,,,,,"4. Amazing view from resort, Food & services were really fantastic ,the Tea could have
 Better. wish they had used milk in tea instead of creamer. overall this is my first family 
trip even first time my mother visit Uttarakhand. & she is very happy i couldn't have been 
happier. ",4,
,,,,,,"5. We were a group of 8 friends went to this hotel. It's in a very secluded place but 
considering the location & beauty of nature it's a must go place, especially for people 
those who seek peaceful places and away from the crowd. This resort is good but food 
is over priced. Go for a package wich includes all meals coz there is no alternate..and 
getting food from outside is next to impossible. Room services are bit slow considering
the distance between cottages. They give u a mobile and there is no land line to
 communicate with the hotel staff. We spend our maximum time in indoor games, which 
was awesome. Rooms are good. Location & view is superb",4,
,,,,,,,,
10,Brahmaputra Jungle resort,http://www.brahmaputraresort.in/,"Welcome to the wilderness of Brahmaputra Jungle Resort a wild rustic jungle retreat and a paradise for nature lovers. Situated in village Tapesia under Sonapur Circle on a plot of land measuring 20 acres, not far away from the International Airport or the Railway Station at Guwahati and just a kilometer from NH 37, the Resort is fast developing into an international tourist destination with guests from various parts of India and abroad visiting. Just 14 kms from Guwahati, the capital of Assam and gateway to the most virgin tourist destination - THE NORTHEAST INDIA, awaits for you the most beautiful and exciting place on earth. Located on top of a hill, with a waterfall and a mini-lake, and surrounded by tea gardens on the front and Amchang Wildlife Sanctuary at the back, Brahmaputra Jungle Resort, in pure jungle ambience, yet fully secured, is just the ideal destination to enjoy your holidays with your near and dear ones.","Near Laxmi Bai Institute of Physical Education, Tapesia, Kamarkuchi Sonapur, Guwahati, 
Assam 782402",097060 99380,"1. A must visit place when you are in Guwahati,Good & friendly staff.Beautiful place 
with lush green environment.Plenty activities to do. stayed for 2 days. very relaxing 
and good place for nature lovers. ",4,
,,,,,,"2. great place to be with your family for a super duper weekend ,,nice food ,well 
behaved stuff and most of all a perfect natural beauty all around..be there and hVE 
FUN..AND IF YOU ARE A FOOD LOVER THAN THIS IS THE BEST PLACE FOR 
TRADITIONAL CUISINE..",3,
,,,,,,"3. The location of the resort is indeed ideal to justify the name- Jungle resort. The 
resort has a main building attached a few spread out structures with rooms. The 
distance from the rooms to reception is substantial and road is rough to walk. 
While the resort has some nice adventure game facilities, the rooms are not 
adequately maintained and laid out. The stay therefore is not very comfortable. 
Some improvements would make this a much better place to stay for families. ",5,
,,,,,,"4. This resort is located on top of a hill, with a waterfall and a mini-lake and is 
surrounded by tea gardens on the front and Amchang Wildlife Sanctuary at the 
back, It boasts of pure jungle ambience. We had children with us who enjoyed the 
elephant ride, pony ride, trampoline, water ball and many other activities. ",4,
,,,,,,"5. I've been visiting Brahmaputra Jungle resort since a long time now. its always
 been a good experience since the location of the resort shares its border with 
Amchung Wildlife Sanctuary. the environment is completely nature oriented. and the 
plus point is that, the resort is just few kms away from Guwahati city. the resort is 
very well maintained and they have surely been successful to keep their customers 
satisfied with good food, hospitality and a scenic location. its been a good 
experience visiting this resort. and i would recommend other people as well to 
visit Brahmaputra Jungle Resort and have a good time.",3,
,,,,,,,,
11,Balaram Palace,http://www.balarampalace.com/,"Balaram Palace Resort, once the hunting retreat of the Lohani Nawab of Palanpur, is now a Heritage Classic hotel. It was built between 1922-1936 by the 29th ruler of Palanpur. It is a graceful manifestation of neo-classical and baroque architectural style. Situated amidst the Aravallis in the 542 sq. kms of Balaram Ambaji Reserve Forest at the tip of North Gujarat it borders Rajasthan. The palace is set in 13 acres of terraced upland rising from a hilly stream and surrounded by lush green gardens and designed flower beds.  The palace was visited by several dignitaries during the British Raj, including Lord Mountbatten.
A stay in the palace takes the tourist into the bygone Nawabi period to experience the real Nawabi ambience and architecture of northern Gujarat. The palatial huge rooms with antiques all around give a sense of royalty. The hunting point existed 3/4th of a century back. Everything around is picturesque and nature is at its best. ","Off. Abu-Palanpur Highway No. 14,Banaskantha, Chitrasani, Gujarat 385010",02742 284 278,"1. Balaram Palace Resort can be rated as one of the best palace resorts available 
in Gujarat.
Built in the midst of jungle with all the luxurious amenities available for stay as well 
as recreation. Lush green lawns with beautiful fountains is a view to remember.
Its said that this was the hunting palace of then nawab.. jessore bear wildlife 
sanctuary is nearby this resort. ",5,
,,,,,,"2. The ambience of the resort is very serene and soothing to the eyes. We feel the 
ambience worth our money. The lush green gardens spread over large area is a
 treat to eyes. The rooms are very big and they maintain the ethnic and historic look.
Resort staff is very very cooperative",5,
,,,,,,"3. Gorgeous gorgeous place!! Early morning was beautiful!!! ( considering that was
 the only time we were in the hotel as we checked in at midnight and checked out 
post breakfast) the rooms have a old world charm with very high ceilings. Some 
rooms have high beds so there is a step provided to get on to the bed. There was 
also a room with a large low sitting!! Verry royal!! ",5,
,,,,,,"4. I love the place, the surroundings, the ambiance, the decor, the food - it's regal, 
it's royal, it's elegant. Roads to get here from Ahmadabad is very decent. A must 
visit if you want to just forget everything for a wee bit and just travel back in time. ",5,
,,,,,,"5. On our way to mount abu from ahmedabad, we decided to stay one night here. 
Location of palace is off Ahmedabad - Mount abu highway and hotel did good job 
of placing signages at right places. We stayed in Gold room which is very basic 
and needs immediate upgrade.  Backside garden shared with all 4 gold rooms is 
nice area for kids to play and my 
5 year kid loved it.",4,
,,,,,,,,
12,Wild Chalet resort,,"Perched on the banks of the Banjar River, Hotel Wild Chalet is the ideal gateway to Kanha National Park. All the beguiling cottages, with a spray of bouganvillae growing over their sloping tiled roofs, command a magnificent view of the river with a backdrop of lush forests, The spacious and extremely comfortable rooms at Wild Chalet Resort are equipped with all modern amenities to ensure a perfect retreat in the Wilds. Individual Sit outs and hammocks strategically positioned are the perfect place to soak in the sun on a winter morning in Kanha National Park.","Village Mocha, Kisli, Near Kanha National Park, Mocha, Madhya Pradesh 481661",07649 277 205,"1. This place is right on the river Banjra, it was dry in May but could imagine the
same at monsoons would be a cozy place to visit in start of the season. ",,
,,,,,,"2. It was a certain breakthrough in amidst the wild that we experienced at the 
WILD CHALET RESORT. The Resort Manager, Mr.Dhiraj, was very co-operative and 
at his toes for us all the time. The experience was simply stunning as the property 
was not just beautifully placed, but also widespread.",,
,,,,,,"3. It's the best place to be if you are visiting Kanha. Located very near to the National 
Park, this property scores highly in terms of accommodation which is beautiful and 
unique, considering it has been the oldest property in Kanha. The food is also very 
good and offers plentiful variety for breakfast, lunch & dinner. The surroundings, 
with a river and light forest, is definitely plus point especially for bird lovers ...
the experience which was enhanced by their in-house naturalist Anukul who made 
our little nature walks oh-so worthwhile. Thanks to the help of Mr. Naqvi who 
ensured that our stay with them was pleasurable. Highly recommended to all. ",,
,,,,,,"4. This resort is situated very close to the core area of the Kanha National Park & 
next to a River. Best location of the resort out of all of them in Kanha. Helpful staff & 
enthusiastic to help and serve always. All the meals are the best.",,
,,,,,,"5. This was my second stay at this indeed nice resort, with a *very* hospitable staff 
and excellent food. The jungle (Kanha National Park) is one of the best in the world 
for tiger sightings. ",,
,,,,,,,,
