S. No.,Category Name,URL if available,Description(Minimum 80 words),location,contact(Multiple If available),Reviews,Rating,Images
44,Vivanta by Taj Begumpet,,"Situated amidst two big cities, Vivanta by Taj, Hyderabad is a name that attracts those with who prefer luxurious comfort. An 
epitome of classy and elegance, this hotel ensures the guests get the best in terms of facility and amenity km from 
Secunderabad Railway Station, 34 km from Rajiv Gandhi International Airport, Conference halls, Boardrooms, Fitness centre, 
Outdoor swimming pool, 2 Restaurants, Bar Vivanta by Taj Begumpet is a luxurious 5 star hotel, located just a few minutes drive
 from Secunderabad Railway Station.
The hotel offers spacious and well-furnished rooms that are divided into four types- Premium Indulgence, Superior Charm, Deluxe
 Allure Suite and Presidential Nirvana Suite. In-room amenities include television, electronic safe and internet connectivity. Guests
 staying in suites with a private sitting/dining area get access to the Rhythm- the on-site lounge. With 8,600 sq ft of conference 
space, two banquet halls and a boardroom, this hotel serves as an ideal venue for hosting business events and parties. A well
-equipped fitness centre, spa and an outdoor swimming pool are other important features of the hotel. Additionally, the hotel 
provides free Wi-Fi upto 2 devices. The Grill and Viva are two on-site restaurants offering a variety of mouth-watering delicacies. To 
enjoy Thai specialities, try Thai Pavilion. Step in Tease- to sip exotic wines, cocktails and other spirits. Lawn and poolside dining 
facilities are also available. Do not miss to try mouth-watering Shaslik, Rotisserie and Brochette grills by Chef Rajeev Janveja at 
The Grill.","1-10-147 & 148, Begumpet, Hyderabad, Telangana 500016",040 6725 2626,"1. Hyderabad one city I visit very frequently..actually love to go there. This time it was Taj 
Vivanta ..just one night. Goan food fest was on. The dinner was simply superb..fish , fish 
and more fish!! Super care by the hotel guys.. Spacious rooms..nice view.. superb.. ",4,
,,,,,,"2. Definently one of the best Indian restaurant. Very nice decor, the food is very tasty and the 
service is good. I have been here a few times and would highly recommend it l. specially
 guys like raghav ,viresh, Raj and amrit are too enthusiastic and full of energy. Worth it !!!!! ",,
,,,,,,"3. Have been visiting this property since some time..Right from the entrance, till you check
 into your room, everyone sports a smile...very good service overall, pool side restaurant is
 good..buffet breakfast has a lot of variety...overall value for money.. ",,
,,,,,,"4. The best thing about the taj hotels is the quality of food they serve ! The lunch buffet here is
 very special including the Chinese fish starter biryani and a great ending with Choclate 
brownie ! One can have a quality food but take care of your pockets ! ",,
,,,,,,"5. Its located in Prime location of the city. Been there during my last visit of Hyderabad along
 with my friends. Excellent ambience and wonderful support from the crew. Moreover their 
knowledge about the drinks and spirits are good. Should not miss it. My special thanks to
 Mr. Gurmeet and Shiva for their excellent service. ",,
,,,,,,,,
45,Bravura Gold Resort Meerut,http://www.bravuraresort.com/,"BRAVURA GOLD RESORT is an exclusive 5-Star featured facility at Meerut Bypass (Delhi Roorkee Highway), a premier hotel & resort offering vast range 
of facilities at one place.Experience the warmth of nature at BRAVURA GOLD RESORT. You will be surrounded by the beauty & grace of this resort, which 
is intelligently designed to revive you. At BRAVURA GOLD RESORT, we offer you with our world class hospitality services. Besides offering well furnished 
accommodation facilities, we also offer Event Organizing, Bar Services, Banquets and Restaurant Services to our clients.  Large Gardens, 6 Banquet Halls, 
2 Restaurants, Bar, Amusement Centre, Health Club, SPA, Swimming Pool & much more with all modern state of the art infrastructure for a memorable 
wedding functions, rooms that offers you all of the luxury you would expect and value you simply cannot ignore. Hospitality and 24-hour service gives you the 
comfort and attention you’d expect and more. BRAVURA GOLD RESORT is at perfect location to play, eat, party or simply combine business with pleasure. ","Delhi-Roorkee Bypass, National Highway 58, Partapur, Meerut, Uttar Pradesh 250103",081910 79998,"1. Most pleasant stay I've ever experienced. My room was very nice, clean and 
well managed. My room bed was wonderful comfy. Amazing views, delicious 
food and friendly staff. I will stay here again in my next visit.",4,
,,,,,,"2. I spent three days at this resort. An awesome place to feel the cool breeze. 
Clean and lovely rooms. Bravura Teams are really friendly and provide fast
 services. The pool is the largest and very clean. It was one of the best and 
memorable stay.",,
,,,,,,"3. Very Nice place and Ambience. Lots of Open space makes it a plus. 
Definitely class apart in a small city like Meerut. Quality of food is very 
good with courteous staff. It's more of a resort with 4 Star facilities. Regular
 place in my itinerary.

",,
,,,,,,"4. When we checked in at Bravura Gold Resort, we were welcomed with warm
 smiles. The staffs of Bravura make our stay enjoyable and comfortable. 
Delicious and mouth watering food. I have enjoyed everything here, especially
 the fitness gym and pool. I will definitely stay here on my future visits in Meerut 
City.",,
,,,,,,"5. I stayed at Bravura Gold Resort for two nights. Welcoming staff with great 
hospitality. Room was beautifully decorated with all modern amenities. The 
food was awesome and fulfilled with flavored, as I like. Everything was truly 
comfortable and amazing. Thank you Bravura Staff for making my stay memorable.",,
,,,,,,,,
46,Taj Krishna Hyderabad,,"Taj Krishna is situated in Hyderabad. The hotel is designed for the modern nomad, the property provides consistent, courteous
 and crisp service for business and leisure travelers seeking contemporary and refreshing experiences. It stands as an epitome
 of warm hospitality blended with the utmost luxury and comfort. It features laundry, doctor on call, Wi-Fi, room service and many 
The hotel offers a thrilling choice of dining options, sure to delight the epicure. Travelers can halt for a refreshing cup of coffee at 
the in-house tea lounge. The sophisticated on-site bar, is a place to relax and enjoy drinks with good music and great finger foods.
 Keeping in mind the business duties of guests, the hotel is also equipped with conference and banquet hall to host meetings
 and events","Rd Number 1, Banjara Hills, Hyderabad, Telangana 500034",040 6666 2323,"1. Hotel Taj Krishna is the ultimate hotel in Hyderabad. I have tried others but they are no 
patch to what is offered here, be it ambiance; service, smiling staff in every department and
 the over all positive air...leave wow factor! ",4,
,,,,,,"2. Visited for a business trip .Great standard hotel with warm taj hospitality Rooms were 
luxurious suiky clean.Food at breakfast and lunch was excellent but expect more options from 
Taj.But service was warm with individual attention . ",,
,,,"
",,,"3. Had a great buffet this month !. visited during the first week and found the ambience quite 
good !. marble statues of beautiful women looked pretty to the eyes !. The food was great !. 
the ambience good and the staff helpful !. the coffee corner and the dessert section was 
quite good !. overall thumbs up ! ",,
,,,,,,"4. Recently visited this hotel with colleagues,our room was excellent with all modern 
amenietes & comforts. What a place to stay.During our stay we have got very prompt service 
from maintenence department & housekeeping department even at 2 A.M.,which is amazing. ",,
,,,,,,"5. A delightful hotel in the heart of Hyderabad. Elegant and unpretentious decor and 
marvellous ambience. Extremely helpful, efficient and courteous staff. The food on offer was
 of most impressive quality and variety. The conference facilities in the basement were 
second to none. All-in-all a most memorably pleasant experience! ",,
,,,,,,,,
47,Alila Diwa Goa,,"Alila Diwa, Goa is an ideal retreat with the perfect blend of modern luxury and Goa's old world charisma. This hotel has been 
awarded 2013 Times Good Food Awards for its restaurant and bar, Trip Advisor Traveler's Choice 2012 for the trendiest hotel, 
2012 Times Food Awards, 2nd Annual India Leadership Conclave for best managed hospitality group , HICSA 2011 Critics Award 
for best new hotel and DestinAsian Luxe List 2010. This hotel was also listed in Conde Nast Traveler USA Hot List 2010 for best
 new hotels of 2010.","48/10, Village Majorda, Adao Waddo, Salcette, Goa 403713",0832 274 6800,"1. I had been to Alila for an official seminar. The staff was very helpful, courteous and 
accommodating. A very big thank you to the Events teams for organizing the event flawlessly. 
The property is located at a very serene place. Well maintained. The only 1 thing that needs 
improvement is the food spread.",4,
,,,,,,"2. Stayed here for a 2 day business Confrence. Hotel ambience is excellent. Choice of food
 needs a lot improvement. Staff needs more training in terms of service and guest handling 
especially in the dinning area. Overall experience has been ok ",,
,,,,,,"3. This is without doubt the best resort hotel we have ever stayed in. The hotel itself, the 
rooms, the food, the swimming pools and most of all the staff were faultless. ",,
,,,,,,"4.Outstanding Hospitality! Staffs were Excellent and very courteous with great service.DBD 
package was great. We got more than we expect. Its an amazing place, with secluded beach
at which you can visit anytime by the ferry service provided by the resort. ",,
,,,,,,"5, Having been to several top rated resorts in goa over the last 10 years.. This one is 
amongst the best! Wonderful property.. Amazing pool... Spacious and well made up rooms.. 
And decent food spread and last but not the least",,
,,,,,,,,
48,Swissotel Kolkata,,"Swissotel Kolkata is Kolkata’s newest five-star luxury hotel near the airport and is attached to a mall featuring shops, restaurants 
and a multiplex cinema. Located in Rajarhat beside the IT hub, the hotel offers a distinct mix of leisure and business facilities,
 and is noted for its unique offering of Swiss hospitality and attention to detail. Choose from 147 elegantly appointed guest rooms, 
including 10 suites with large open-air terraces, each with its own spectacularly exclusive outdoor Jacuzzi. Executive rooms and the 
Swiss Executive Club lounge provide additional luxury and exclusivity. The award-winning rooftop Sky Lounge is the jewel of the 
hotel’s three restaurants and bar, offering views over the city. An in-house nightclub with resident DJ attracts hip locals and guests 
alike. The sumptuous breakfast buffet offers a wide range of choices to energise your day.","City Centre 2, Biswa Bangla Rd, Kolkata, West Bengal 700157",033 6626 6666,"1. So this is the 3rd time I have stayed at the Swissotel in Kolkata.
I travel here with business every quarter and still never seem to be amazed at how friendly, 
polite and generous the staff are. ",4,
,,,,,,"2. There is nothing not to like about this hotel! The breakfast is excellent. The supper is 
excellent, whether you order from the menu or do the buffet.",,
,,,,,,"3. Swissotel is always our preference for any of our event be it national or International we
 blindly choose Swissotel for their all rounder experience .We would surely come back and 
do a bigger event as always.",,
,,,,,,"4. Always felt valued , each time I visit it's a experience that I cherish for long time , great 
place to stay , from check in to restaurant to check out it was a experience , courtesy of staff 
was at its best . ",,
,,,,,,"5. Modern hotel in new Kolkata, near the airport. Chick service. Privacy. Good overlook
 toward the city. Green resent on the horizon. Excellent communication facility. Fast water : 
hot and cold. Good food catering. Equipped silence : tranquility. ",,
,,,,,,,,
49,The Leela Palace Chennai,,"The Leela Palace Chennai lavishes guests with some of the largest guestrooms in the city and with panoramic views of the Bay 
of Bengal. Close to the central business district and local attractions, Leela Palace is the top luxury hotel in Chennai. Regal 
opulence and personalized service are the standards at The Leela Palace Chennai, set on 4 acres of land where the Adyar River 
meets the sea. Evoking the rich heritage of India’s palaces, this five-star hotel features a spa, luxurious meeting space, and a 
variety of international dining options.","Adyar Seaface, M.R.C Nagar, Chennai, Tamil Nadu 600028",044 3366 1234,"1. We had an company meet and it was an gala time with my colleagues enjoying every bit
 of the moment. Everything was perfect nice food and buffet was tasty. Row were huge and 
clean. Must place for filly stays. Kids would love to stay here. Great lawn attached makes it 
an out and put personal affair...",4,
,,,,,,"2. Leela is world class hotel with amazing facilities. Hotel was very clean and nice ambience. 
Food was ok like five star hotel but for all palates. Hotel has sea view which is very nice to
 look at even from lobby and breakfast room. I will recommend and come back with family 
soon. ",,
,,,,,,"3. The Leela is a true five star hotel. The staff are very eager to help. The breakfast buffet is 
excellent. The showers have hot water and good pressure. Wifi works well, and the gym is 
OK. The Chinese restaurant in the hotel is pretty good. ",,
,,,,,,"4. This was my third visit at The Leela Palace. Awesome Place. Superb Staff as always. A big 
thumbs up for the concierge team for accommodating our request so professionally. Keep it
 up. We will be back soon.",,
,,,,,,"5. A real haven in the hustle and bustle of Chennai. It felt a very luxurious stay. Incredibly
 good service and felt very looked after. The staff even checked in when I was unwell and 
brought me coconut water. Pool nice to hang out by after sightseeing during the day. ",,
,,,,,,,,
50,The LaLiT Temple View Khajuraho,,"Khajuraho - a UNESCO world heritage site is a city of beautiful temples that date back to 950 AD. Embellished with inspirations 
from this rich and exotic locale, The Lalit Temple View Khajuraho, overlooks the Western Group of Temples famed for their erotic 
sculptures.A destination of contemplation and calm, The Lalit Temple View Khajuraho is located just minutes away from the
 international airport and railway station. The hotel features 47 exquisitely appointed rooms & suites, fine dining restaurant & a bar,
 besides three banquet & conference venues and the award-winning Rejuve – The Spa.The Lalit Temple View organises special 
evening programmes for guests reflecting the heritage and culture of the City of Exotic Temples like an in-house light and sound
 show and the traditional Sandhya Aarti (evening ritual).","Opposite Circuit House, Sevagram, Khajuraho, Madhya Pradesh 471606",076862 72333,"1. Everything was ok in general. But we felt dissapointed that weasked if there was anything 
to do around town and they said no, then we were in the garden and heard how there were 
festivities in a show hall nearby... The service in the restaurant was really nice though and the 
room was ok in general.
",4,
,,,,,,"2. Had a great experience.. the complete package was worth each penny.. 100 marks to the 
spa session.. best experience.. The staff is really helpful.. i would suggest to take the temple
 view room for the best view from the room.. ",,
,,,,,,"3. Check inn process is very comfortable. Rooms are well maintained. Reception staff is very
 cooperative. All staff nature was very nice. Check out process was very very easy and good. 
Phone pickup was very fast.Overall everything was fully satisfied. ",,
,,,,,,"4. I was looking for the best stay..when i found the lalit on trip advisor.. After reading the 
reviews i chose this property.. and full marks to it.. Its a grand property with best in class 
amenities.. highly recommended.. just go for it with no 2nd thought.. you will surely thanks 
me later.. ",,
,,,,,,"5. A perfect spot for a relaxing vacation.. freindly staff.. nice and cozy accommodation.. loved
 the room had a great view from the room..all-in-all a memorable stay..will surely love to visit
 again with family.. ",,
,,,,,,,,
51,ITC Mughal,,"Sprawled over 35 acres of luxurious gardens, and in close proximity to the Taj Mahal, ITC Mughal, a luxury hotel in Agra is a fitting
 tribute to the great Mughal builders of the past. The only Indian hotel to have won the prestigious Aga Khan Award for its excellent
 representation of Mughal architecture, it now boasts of a brand new Royal Mughal Suites. This luxury hotel in Agra comprises of 
233 opulent rooms and suites, recreating a paradise for the contemporary Mogul- full of splendor and perfection which was the 
hallmark of the Mughal Dynasty.","Tajganj, Agra, Uttar Pradesh 282001",0562 402 1700,"1. We had a standard room but was well furnished and everything clean. Plenty of marble. 
Indoor pool and gym. Comfortable bed and we slept well. Staff very attentive, buffet dinner and 
breakfast with good variety of food. ",4,
,,,,,,"2. The property is really grand and thanks to the suite room, room was spacious and even the
 bathrooms were sprawling in terms of space. The services especially arrangement of guide 
or even a car at short notice was done so quickly. agra was awesome because of your 
property ",,
,,,,,,"3. A luxurious hotel near the Taj Mahal which makes you fill like a Maharaja king Nice large 
room beautiful garden and you can see the majestic top of the Taj Dinner was excellent. 
Looking forward for tomorrow to go to see the Taj Mahal only ten minutes Away at sunrise ",,
,,,,,,"4. I was here for a conference. The food and hospitality was amazing, something that I will 
never forget. It is a heritage hotel, lots of garden areas which I liked. I checked out the rooms
 too, they were super luxurious and clean. ",,
,,,,,,"5. Extremely grand hotel. very clean, welcoming. Staff very pleasant. Food good and a great 
variety. Local shops are varied, don't buy near the hotel as more expensive. Just down the
 road, it is proper India and welcoming by the local people.",,
,,,,,,,,
52,The Oberoi Grand West Bengal,,"Fondly known as the Grand Dame of Chowringhee, The Oberoi Grand is situated in a prime location, unrivalled by other luxury
 hotels in Kolkata, near the central business district, bustling markets and cultural landmarks of the city. Dating back to the late 
1880s, The Oberoi Grand, Kolkata was frequented by the country's leading figures during colonial times and even now, hosts 
grand functions for Heads of State in the city's largest pillarless Grand Ballroom. Guests looking for a luxury dining restaurant in 
Kolkata can choose between our award winning, authentic Thai restaurant, our all day dining space and our colonial style bar. 
Branching off the hotel's naturally lit walkway, each restaurant is tastefully decorated, offers unparalleled fine dining and matchless 
service.","15, Jawaharlal Nehru Road, Kolkata, West Bengal 700013",033 2249 2323,"1. In a chaotic city, this is an oasis of calm, with extraordinary staff, great food in the 
restaurants, beautiful rooms and public spaces, and pool. Early morning yoga is a
 wonderful way to start the day. ",4,
,,,,,,"2. I think it is best hotel in Kolkata. The experience of staying at an Oberoi is something no 
other hotel in India can give you. The property might be a bit old, but the rooms are
 tremendously comfortable and the staff is warm and friendly. If you find yourself in Kolkata, 
treat yourself to a night at the Oberoi. ",,
,,,,,,"3. first time in The Oberoi , Kolkata . what a place !!! Amazing experience ... starting from the 
reception to check out ,.. everything was just royal . They treat you like royalty ... the rooms are
 excellent.. cant expect a view due to the surroundings. Tried the Ban Thai restaurant ... 
lovely food .. would strongly recommend it . ",,
,,,,,,"4. Fab location, great ambiance and traditional Oberoi Service. The hotel, food and service is 
a cut above the rest here. We were in for a surprise when we reached the hotel where there 
were personalized amenities for my baby and a gracious welcome note. I had the most 
comfortable pillows and bed ! ",,
,,,,,,"5. a serene place just next to new market enjoyed the calmness and had a good holiday 
experience. good food in hotel and around(new market) as well. a must go for kolkata visitors
 even if you are tight on schedule. ",,
,,,,,,,,
53,The Metropolitan Hotel New Delhi,,"THE METROPOLITAN HOTEL & SPA, New Delhi, is a Five Star Deluxe full service hotel located in the heart of the business and 
commercial hub of New Delhi, and provides easy access to most of the corporate and financial centres, ministries, embassies 
and the International Trade Fair grounds. THE MET is the perfect destination for an international traveler looking for easy access to
 doing business in New Delhi. This urban oasis with its luxurious ambiance and lush landscaping is an experience in itself. Eac
h of the meticulously designed guest rooms and suites at the hotel features personalized comfort, luxury and all the necessary 
amenities to satisfy the modern discerning traveler.","Bangla Sahib Road, New Delhi, Delhi 110001",011 4250 0200,"1. This place has nice and modern rooms. The hotel has lot of restaurants so you have 
choises to stay inside. In fact I do not recommend to go outside as there are many homeless 
people. New delhi is huge so staying in the center is convenient if you are moving by car/taxi. ",3,
,,,,,,"2. I recommend The Metropolitan Hotel and Spa New Delhi for a chance in a life time to 
experience an incredible stay where one will be blown away with the Highest of high quality
 in all aspects of your stay. From accommodation to the choice of food to the kind and friendly 
staff. So make sure you eat at least Breakfast to experience the vast and tasty choice and to 
greet the staff with a happy smile and they will take good care of you.",,
,,,,,,"3. Massages were perfect after a tiring day sightseeing. The staff were friendly and very 
helpful. The Spa was like an oasis of calm and serenity. The treatments were not overpriced 
and there was plenty of choice ",,
,,,,,,"4. I come here for the 15th time and like it a lot. Very good price / quality. All major sites are 
quite nearby. Food in restaurant is good. Last time I had the lamb curry and one of the best I 
have eaten so far. I asked the chef cook Irfan Ahamad for the recipe. Great job ! ",,
,,,,,,"5. Nice hotel but needs s bit of upkeep and updating. Very helpful staff especially the conceige
 . Breakfast is good and you could request for a lovely expresso coffee. The rooms are clean
 but just need updating . Very central and a stones throw to Connaught place . ",,
,,,,,,,,
54,lebua Resort Jaipur,,"The newly launched lebua Resort, Jaipur is already generating interest for its contemporary vision of Indian design. Planned as a
 spa destination, inspired by the architectural traditions of Rajasthan, it promises to deliver an experience as unique as at Devi 
Garh by lebua which is known to deliver unmatched luxury experience for years. The philosophy is about living with history, keeping
 an awareness of our past while looking towards the future. Old and new, culture and modernity, craft and design at every level of the
 philosophy one finds harmony in contrast and modernity going hand-in-hand with our heritage, with the vision of operating a 
collection of unique luxury Boutique Hotels, establishing global standards of product quality and service excellence.","Agra Road, Tehsil Ballupura, Jamdoli, Rajasthan 302031",0141 305 0211,"1. Place is surrounded by mountains. I will suggest to visit this place in rainy season or 
winters. Resort offers nice pool with excellent view. Rooms are well equipped with all the
 luxuries. The villas are spacious and huge. The staff is well trained to handle guests. I will
 recommend this resort. ",3,
,,,"
",,,"2. Luxury suite was huge, and lavish bathroom. But amenities and decoration was not upto
 the mark. Jaqquzzi and Door lock was not working and have to call to get them fixed. Took 
more than 30 minutes to fix. Overall nice experience with complementary horse riding, 
puppet shows, and the overall ambience of the place. ",,
,,,,,,"3. Lavish meadows and huge rooms which give space to your crowded mind and gives it 
a let go .. Peaceful and clean and very well maintained with some great innovative ideas 
used here to take away .. Fun with friends is guaranteed ",,
,,,,,,"4. Just perfect. Fantastic place for business as well as family stay. Spread in huge area. 
Rooms are beautifully done. Good food good ambience good staff in total value for money 
resort. Even a good resort if you want to entertain some foreign guests. ",,
,,,,,,"5. resort is amazing but room service is very slow. food is good. rooms are clean and are
 very well maintained. There is a large swimming pool and the view from there is 
enthralling. A very good place to enjoy a weekend in Jaipur. , ",,
,,,,,,,,
